{
  "name": "example.env/v1",
  "title": "Example environment driver",
  "protocol_version": "1.0",
  "plane": "bind_time",
  "delivery_forms": ["env_file", "credential_file"],
  "env_names": ["EXAMPLE_TOKEN", "EXAMPLE_TOKEN_FILE", "EXAMPLE_DRIVER_PROCESS"],
  "config_schema": {
    "type": "object",
    "additionalProperties": false,
    "properties": {
      "file": {
        "type": "boolean",
        "description": "Also write the credential to ~/.srw-files/example/token, named by EXAMPLE_TOKEN_FILE",
        "x-srw-order": 1
      },
      "kube": {
        "type": "boolean",
        "description": "Also write the credential to ~/.kube/example-token",
        "x-srw-order": 2
      },
      "misbehave": {
        "enum": ["denied_variable", "undeclared_variable", "refused_file", "fail"],
        "description": "For SRW's own gate only: make bind return what SRW refuses, or fail",
        "x-srw-order": 3
      }
    }
  },
  "credential_slots": [
    {
      "name": "token",
      "kind": "secret_string",
      "schema": {
        "type": "object",
        "properties": {"token": {"type": "string", "writeOnly": true}}
      },
      "required": true,
      "update": "replace"
    }
  ],
  "access_levels": [
    {
      "id": "ReadOnly",
      "rank": 0,
      "enforced_by": "Told to the agent only; the same credential is delivered either way.",
      "advisory": true
    },
    {
      "id": "ReadWrite",
      "rank": 1,
      "enforced_by": "The upstream credential decides what is allowed."
    }
  ],
  "default_access": "ReadWrite",
  "supported_backends": ["sandbox", "vm"],
  "workspace_requirements": "A shell workspace: the variables are sourced for every command.",
  "operations": ["gc"],
  "egress": [],
  "holds_upstream_credentials": true
}
